{
  "schema_version": "audit-topology/v1",
  "topology_id": "topology_00000000000000000000000000000000",
  "steps": [
    {
      "step_id": "step_11111111111111111111111111111111",
      "plan_ref": {
        "plan_id": "plan_11111111111111111111111111111111",
        "record_digest": "1111111111111111111111111111111111111111111111111111111111111111"
      },
      "predecessor_step_ids": []
    },
    {
      "step_id": "step_22222222222222222222222222222222",
      "plan_ref": {
        "plan_id": "plan_22222222222222222222222222222222",
        "record_digest": "2222222222222222222222222222222222222222222222222222222222222222"
      },
      "predecessor_step_ids": ["step_11111111111111111111111111111111"]
    },
    {
      "step_id": "step_33333333333333333333333333333333",
      "plan_ref": {
        "plan_id": "plan_33333333333333333333333333333333",
        "record_digest": "3333333333333333333333333333333333333333333333333333333333333333"
      },
      "predecessor_step_ids": [
        "step_11111111111111111111111111111111",
        "step_22222222222222222222222222222222"
      ]
    }
  ],
  "authority_effect": "none"
}
